,en,gr
0,EC-Bulgaria Agreement: participation in the work of the European Monitoring Centre for Drugs and Drug Addiction (vote),EB ir Bulgarijos susitarimas: dalyvavimas Europos narkotikų ir narkomanijos stebėsenos centro veikloje (balsavimas)
1,"I was the rapporteur for the opinion of the Committee on the Internal Market and Consumer Protection and after in-depth deliberations, the committee adopted this position by consensus.",Buvau Vidaus rinkos ir vartotojų apsaugos komiteto šios nuomonės referentas; po išsamių svarstymų komitetas konsensu patvirtino šią poziciją.
2,The Gdańsk Shipyard is a symbol of the historical changes in Poland and also of the major changes that have occurred in Europe and internationally.,"Gdansko laivų statykla - istorinių permainų Lenkijoje, taip pat ir svarbiausių Europoje ir pasaulyje įvykusių pokyčių simbolis."
3,"We should authorise them in Finland and Sweden, which have huge open stretches for the transport of timber.","Turėtume leisti juos naudoti Suomijoje ir Švedijoje, kur didžiuliai atviri plotai, medienai gabenti."
4,"Specifically, there is no scientific evidence to demonstrate the effectiveness of health warnings on labels in terms of preventing abusive consumption.","Tiksliau, nėra konkrečių duomenų, kurie įrodytų perspėjamųjų etikečių dėl sveikatos veiksmingumą atliekant piktnaudžiavimo alkoholiu prevenciją."
5,"Instead of trading too much liberty for security, let us look at what really works: targeted investigations and intelligence-led policing.","Vietoj to, kad atiduotume per daug laisvės už saugumą, verčiau atkreipkime dėmesį į tai, kas iš tikrųjų veikia: tiksliniai tyrimai ir policijos darbas, remiantis žvalgybine informacija."
6,"A lack of confidence in the market has damaged even attractive assets, which ought not to have been subject to the downward price correction.","Pasitikėjimo trūkumas rinkose pakenknet patraukliam turtui, kurio neturėjo paveikti neigiama kainų korekcija."
7,"We have not taken a position on how the UN Security Council should deal with the situation in Burma, offering no support for a resolution.","Turime išreikšti savo poziciją dėl to, kaip JTO Saugumo Taryba turi spręsti situaciją Birmoje ir jokiu būdu neparemti susiskaidymo idėjos."
8,in writing. - (PL) I voted in favour of adoption of the report on the functioning of the human rights dialogues and consultations on human rights with third countries.,raštu. - (PL) Balsavau už pranešimą dėl dialogų ir konsultacijų žmogaus teisių klausimais su trečiosiomis šalimis veiksmingumo.
9,"Therefore, it is 'yes' to renewable sources but 'no' to a militant attack without factual debate and arguments.","Todėl ""taip"" atsinaujinančios energijos šaltiniams, tačiau ""ne"" karingiems reikalavimams ir faktais nepagrįstoms diskusijoms ir argumentams."
10,"I ask Mrs Fischer Boel to support this, as it would encourage further reductions and help restore a balance in the market.","Prašau Fischer Boel pritarti šiai nuostatai, nes tai skatintų daugiau sumažinimų ir padėtų grąžinti pusiausvyrą rinkoje."
11,"Parliament was able to stand up to the Member States and the rail companies for the rights of passengers, which is a huge success for the citizens of the EU.",Parlamentas sugebėjo pasipriešinti valstybėms narėms ir geležinkelių bendrovėms ir apgynkeleivių teises - tai yra didelsėkmES piliečiams.
12,"Member of the Commission. - First of all, I think that everybody who watched the devastating forest fires in Greece on the television wondered what would happen afterwards with the damaged areas.","Komisijos narė. - Pirmiausia, manau, kad kiekvienam, stebėjusiam per televiziją Graikijos miškus siaubiančius gaisrus, kilo klausimas, kas bus toliau žalą patyrusiose vietovėse."
13,"In my opinion, we should bear this aspect in mind when debating the establishment of our common foreign policy on energy.","Mano nuomone, turime turėti omenyje šį aspektą, svarstydami mūsų bendros užsienio politikos energetikos srityje sukūrimą."
14,"For this very reason, whether we are dealing with illegal or legal migration, we must not go down the path of a one-size-fits-all approach.","Dėl to, ar užsiiminėtume nelegalia ar legalia migracija, neturime eiti vienodų sąlygų požiūrio keliu."
15,"Under the auspices of the Polish Parliament an investigation was also carried out by a permanent committee, on which the opposition is represented.","Remiamas Lenkijos parlamento nuolatinis komitetas, kuriam atstovauja opozicija, atliko tyrimą."
16,"In my view, both reports - the Roithová report and the Lehtinen report - give important indications of the deficits that still exist.",Mano požiūriu abu pranešimai - Zuzanos Roithovos ir Lasse Lehtineno - rodo svarbius vis dar esamų trūkumų ženklus.
17,"What is new is that 255 pages of changes have now been inserted in 2 800 pages of treaty, making the text unreadable for everyone but nerds - again, what scheming, lousy behaviour.","Nauja tai, kad padaryta net 255 puslapių pakeitimų 2 800 sutarties puslapių, todėl tekstas tampa įskaitomas tik visiškoms nuobodoms - vėlgi klastingo, bjauraus elgesio pavyzdys."
18,"on behalf of the UEN Group. - (PL) Mr President, I was a member of the five-man delegation from the European Parliament which spent a couple of important days in the Palestinian Autonomous Area.","UEN frakcijos vardu. - (PL) Pone pirmininke, man teko būti penkių žmonių Europos Parlamento delegacijos nariu ir porą dienų praleisti Palestinos autonominėje teritorijoje."
19,It comprised provisions on cooperation between Philip Morris and the European Union in tracking and tracing cigarettes.,"Ji apėmnuostatas dėl ""Philip Morris"" ir Europos Sąjungos bendradarbiavimo sekant cigaretes."
20,"Transport infrastructure is often the decisive factor for the location of regional investment, tourism development and rapid transportation of goods.","Susisiekimo infrastruktūra dažnai yra esminis veiksnys parenkant regioninių investicijų vietą, sprendžiant dėl turizmo plėtros ir operatyvaus prekių pervežimo."
21,The Commission would prefer Member States to have a margin of flexibility and set the appropriate width for buffer zones in line with their own geographical features.,"Komisija norėtų, kad valstybės narės turėtų lankstumo ribą ir nustatytų atitinkamą apsauginių zonų plotį, atsižvelgdamos į savo geografines ypatybes."
22,"Debates on cases of breaches of human rights, democracy and the rule of law (announcement of motions for resolutions tabled): see Minutes","Diskusijos dėl žmogaus teisių, demokratijos ir teisės pažeidimo atvejų (numatytų rezoliucijų projektų paskelbimas): žr. Posėdžio protokolai"
23,"in writing. - (PT) In March 2007, France requested the mobilisation of the EGF in respect of the redundancies of 1 345 workers of Renault SA and 1 057 workers of Peugeot SA and their suppliers.","raštu. - (PT) 2007 m. kovą Prancūzija paprašsutelkti EGF dėl netekusių darbo 1345 ""Renault"" SA ir 1057 ""Peugeot"" SA darbuotojų ir jų tiekėjų."
24,"This also applies to further acknowledgement of Parliament's interests, as expressly - and correctly - called for by the Committee on Development.","Tai taip pat taikytina Parlamento interesų pripažinimui, ką aiškiai ir teisingai paragino padaryti Vystymosi komitetas."
25,"The success of the anti-smoking campaign shows us that multinational companies, such as the tobacco companies, are not unbeatable.","Prieš rūkymą nukreiptos kampanijos sėkmrodo, kad tarptautinės bendrovės, tokios kaip tabako bendrovės, nėra nepalaužiamos."
26,"This requires, as we have always found, special arrangements to facilitate cross-border cooperation and local border traffic.","Jam reikalinga speciali tvarka, kuri palengvintų pasienio bendradarbiavimą ir judėjimą per vietos sieną."
27,Turkey continues to occupy a Member State of the European Union: 40% of Cypriot territory is under Turkish military occupation.,Turkija tebėra okupavusi Europos Sąjungos valstybę narę: 40 proc. Kipro teritorijos yra okupavusi Turkijos kariuomenė.
28,The Commission also makes use of the humanitarian aid instrument managed by ECHO to fund humanitarian demining efforts.,"Komisija taip pat naudoja humanitarinės pagalbos priemonę, numatytą pagal ECHO finansuoti humanitarinius išminavimo veiksmus."
29,"rapporteur. - (DE) Madam President, now that Mrs Lulling has addressed me directly, may I say that just because others are doing things badly, that should not be a role model for us.","pranešėjas. - (DE) Gerb. pirmininke, dabar, kai A. Lulling kreipėsi į mane tiesiogiai, norėčiau pasakyti, kad jeigu kiti dirba blogai, mes neturėtume imti iš jų pavyzdžio."
30,Every effort must be made to establish their fate and help bring them safely back to their loved ones.,Turi būti dedamos visos pastangos juos išlaisvinti ir saugiai sugrąžinti gyvus.
31,I also believe that Mr Liese has further improved it. This is a classic case of the internalising of external costs.,"Pirmininke, visada įdomu išgirsti, kaip kai kurie Parlamento nariai atsisako priimti tikrovę.Mano nuomone, Komisijos pasiūlymas geras.Taip pat manau, kad P. Liese jį dar pagerino.Tai - klasikinis išorinių kainų perėmimo atvejis."
32,"I voted in favour of the report, because recently the candidate for Prime Minister of my country declared that public television should be weakened.","Aš balsavau už pranešimą, nes neseniai mano šalies kandidatas į Ministrus Pirmininkus pareiškė, kad visuomenintelevizija turėtų būti silpninama."
33,"In reply to your question I can assure you that we do have emergency response measures, including those for post-conflict periods, and that we are trying to implement them.","Atsakydamas į jūsų klausimą galiu užtikrinti, kad mes neturime skubios pagalbos priemonių, įskaitant ir tas, kurios taikomos konfliktą patyrusiems regionams, tačiau stengiamės jas sukurti."
34,"Economic progress is the prerequisite for social security - not the other way round, as we have heard it suggested in a few speeches in this House.","Ekonominpažanga yra būtina sąlyga socialiniam saugumui, bet ne atvirkščiai, kaip išgirdome teigiant keliuose pasisakymuose."
35,I support amendments to the effect that those applying equal or higher standards must be free to do so.,"Aš palaikau tuos pakeitimus, kuriuose siūloma priverstinai netaikyti direktyvos nuostatų toms šalims, kuriose jau galioja direktyvoje reikalaujamą dirvožemio apsaugos lygį atitinkantys ar jį viršijantys standartai."
36,"At the present time, Ukraine pays its debts to Russia with gas supplies from its own underground deposits.",Šiuo metu Ukraina moka Rusijai skolas tiekdama jai dujas iš savo požeminių telkinių.
37,Our concern must be to offer social protection to all employees and to enable their social inclusion.,Mes turėtume rūpintis pasiūlyti socialinę apsaugą visuems dirbantiesiems ir sudaryti sąlygas jų socialinei integracijai.
38,"This means that the Charter, in its own way, is a moral, legal and political reflection of the unity of the European Union: West and East, North and South.","Vadinasi, pati chartija yra moralinis, teisinis ir politinis Europos Sąjungos vienybės atspindys. Vakarų ir rytų, šiaurės ir pietų vienybės."
39,"Parliament's resolution, prepared by a political group, sets out clearly the need to look forward to these now fast-moving negotiations.","Politinių frakcijų parengtoje Parlamento rezoliucijoje aiškiai nurodoma, kad būtina žiūrėti į šių dabar greitai besivystančių derybų ateitį."
40,"in writing. - (DE) Developments in recent years have shown that European tourism, like any other economic sector, is strongly influenced by wider global conditions.","raštu. - (DE) Pastarųjų metų plėtra parodė, kad Europos turizmui, kaip ir kitiems ekonomikos sektoriams, didelę įtaką daro globalizacija."
41,"But financing, clearly, is only appropriate for those parties which are politically correct in their thinking on Europe.","Tačiau akivaizdu, kad finansuoti tinkama tik politiškai korektiškai apie Europą mąstančias partijas."
42,Member States will have to establish marine-protected areas to meet their objectives under this directive in accordance with the international commitments of the Community and the Member States.,Valstybės narės privalės nustatyti saugomas jūrų zonas direktyvoje joms keliamiems tikslams pasiekti ir prisidėti prie tarptautinių Bendrijos ir valstybių narių įsipareigojimų vykdymo.
43,"We fully share Parliament's concern, also expressed in its comments on the Instrument for Stability strategy, that a security gap in this important humanitarian field has to be avoided.","Visiškai suprantame Parlamento susirūpinimą, reiškiamą ir pastabose priemonei dėl stabilumo strategijos, kad šioje svarbioje humanitarinėje srityje būtina vengti saugumo spragų."
44,"There were now lower rates of VAT for French catering entities, CDs and activities generating a workforce.","Mažesnių PVM tarifų Prancūzijos viešojo maitinimo įmonėms, kompaktinėms plokštelėms ir darbo jėgą teikiančiai veiklai nebuvo."
45,"It is our political duty to present specific results by 2010, in other words when we meet up again for the Third EU-Africa Summit.","Turime politinę pareigą pateikti konkrečius rezultatus iki 2010 m., kitaip tariant per mūsų ateinantį susitikimą trečiajame ES ir Afrikos aukščiausio lygio susitikime."
46,"The recognition of that occupational group must be taken further, and another task on the agenda will be to cut emissions and to make aviation less harmful to the climate than it has been to date.","Turi būti toliau vykdomas profesinės grupės pripažinimas, o kitas darbotvarkės uždavinys bus sumažinti emisijas ir padaryti taip, kad aviacija būtų mažiau žalinga klimatui, nei ji buvo iki šiol."
47,"Almost 60 years later the European Union codified human rights in its Charter of Fundamental Rights, a document meeting the needs and expectations of Europeans on the threshold of the 21st century.","Beveik po 60 metų Europos Sąjunga kodifikavo žmogaus teises savo Pagrindinių teisių chartijoje - dokumente, atitinkančiame europiečių poreikius ir lūkesčius stovint ant slenksčio į XXI amžių."
48,"The Host City Contract, the human rights clause in the Chinese Constitution, the Universal Declaration of Human Rights - these are promises made to China's citizens.","Kinija pasižadėjo savo gyventojams pagal miesto rengėjo sutartį, Kinijos konstitucijos žmogaus teisių nuostatas ir Visuotinę žmogaus teisių deklaraciją."
49,"There is considerable room for corruption, especially in the cases of construction and land-use planning, privatisation, concessions and public procurement.'","Daug galimybių korupcijai pasireikšti statybos ir žemėtvarkos, privatizavimo, koncesijų ir viešųjų pirkimų srityje""."
50,The development of the Mediterranean countries with which we want to create a partnership depends on our ability to offer them firm commitments on policies and sectors of common interest.,"Viduržemio jūros regiono valstybių, su kuriomis norime užmegzti partnerystės santykius, plėtrą lemia mūsų sugebėjimas pasiūlyti joms tvirtus įsipareigojimus ir visiems patrauklius sektorius."
51,That same year the Asian Women's Fund was set up to grant reparations and medical aid to survivors on behalf of the Japanese Government and people.,"Tais pačiais metais buvo įsteigtas Azijos moterų fondas, kurio tikslas - Japonijos vyriausybės ir žmonių vardu teikti kompensacijas ir medicininę pagalbą išgyvenusioms aukoms."
52,"Therefore, it is important to support new cars, because they are better, to support better road systems, better transport systems, better fuels and better engines.","Todėl svarbu remti naujus automobilius, nes jie yra geresni, remti geresnes kelių sistemas, geresnes transporto sistemas, geresnį kurą ir geresnius variklius."
53,Public opinion tends to take more notice of industrial accidents than of the wide diversity of occupational diseases.,"Viešoji nuomonyra linkusi kreipti daugiau dėmesio į pramonines avarijas, negu į didelę profesinių ligų įvairovę."
54,"Mr Vice-President Frattini's words have cast a little doubt, but nonetheless I hope that the Agency will be consistent in protecting human rights.","Pono Komisijos pirmininko pavaduotojo F. Frattini žodžiais yra teisingi, tačiau aš tikiu, kad Agentūra nuosekliai gins žmogaus teises."
55,"Obviously, the ability to anticipate prices several months in advance by predicting the harvest is a highly interesting prospect for the stock markets in Chicago or wherever.","Aišku, kad galimybnumatyti kainas dar prieš kelis mėnesius prognozuojant derlių yra didelį susidomėjimą Čikagos ar kitų didmiesčių vertybinių popierių rinkoms kelianti perspektyva."
56,"- (PL) Mr President, Slovenia is the first of the new Member States to take on the Presidency of the European Union.",- (PL) Pone Pirmininke! Slovėnija yra pirmoji iš naujųjų valstybių narių pirmininkaujanti Europos Sąjungai.
57,"We must not forget about the street children and the children of migrants, who are also exposed to violence.","Mes negalime pamiršti apie gatvėse augančius vaikus ir migrantų vaikus, kurie nuolat kenčia nuo prievartos."
58,"President-in-Office. - (SL) The ever-increasing cost of energy, especially fuel, and of food is a global problem and therefore also a problem for the European Union.","Pirmininkas. - (SL) Nuolat augančios energijos kainos, ypač kuro ir maisto, yra pasaulinproblema, o tuo pačiu ir Europos Sąjungos problema."
59,"Russia is funding projects of its own, and is strengthening its position on the Central Asian market.",Rusija finansuoja savo pačios projektus ir stiprina savo pozicijas Vidurio Azijos rinkoje.
60,Yesterday the EU troika carried out a firm démarche to the Chinese authorities asking for his immediate release.,Vakar ES trejetas surenggriežtą demaršą Kinijos valdžios institucijoms prašydamas nedelsiant jį paleisti.
61,Since that time the reformist president Khatami has been replaced by the representative of a much harder political line.,Nuo to laiko reformų šalininką prezidentą Khatamį pakeitgerokai kietesnės politinės linijos atstovas.
62,"Under Article 23 of the Directive, the European Commission must prepare a report on the application of this Directive, including information about the groups mentioned above.","Pagal Direktyvos 23 straipsnį Europos Komisija privalo parengti ataskaitą dėl šios Direktyvos taikymo, įskaitant informaciją apie anksčiau paminėtas grupes."
63,"As a matter of fact, this report comes at a time where all initiatives aiming at reinforcing concrete actions for greater energy efficiency should be warmly welcomed.","Iš tikrųjų šis pranešimas parengtas, kai visos iniciatyvos, skirtos sustiprinti konkrečius efektyvesnio energijos vartojimo veiksmus turi būti nuoširdžiai vertinamos."
64,"(CS) Mr Chairman, today, after many years, our discussions have come to an end and we have agreed to provide all citizens of the European Union with a fully open market in postal services.","(CS) Pone Pirmininke, šiandien po daugelio metų baigėsi mūsų diskusijos ir susitarėme pilnai atverti rinką pašto paslaugų srityje visiems Europos Sąjungos piliečiams."
65,"However, in order to avoid misunderstandings, may I remind you that it is not up to the Commission to lay down rules for Parliament.","Tačiau, kad išvengtume nesusipratimo, gal galiu Jums priminti, kad Komisijos kompetencijai nepriklauso nustatyti taisykles Parlamentui."
66,"I do not intend to read them out here, but they are extremely clear and precise, and may be assessed with the same kind of precision.","Neketinu skaityti jų visų čia, tačiau jie yra visiškai aiškūs ir tikslūs ir taip pat tiksliai gali būti įvertinti."
67,"Secondly, we have greater clarity surrounding the CE mark but I agree with Mrs McCarthy and Mrs Gebhardt that we need to work on a real safety label in the future.","Antra, atsirado daugiau aiškumo dėl CE ženklo, bet aš pritariu poniai McCarthy ir poniai Gebhardt, kad ateityje turime sukurti tikrai saugų ženklą."
68,Scotland has much to contribute to the European Union and its development: a constructive attitude and a wealth of energy resources to name but two.,Škotija galėtų įnešti didžiulį indėlį į Europos Sąjungą ir į jos plėtrą: užtenka paminėti konstruktyvų požiūrį ir energijos išteklių gausybę.
69,"Is one of our aims really to become, let us say, the most dynamic, competitive and best region in the world by the year 2010?","Ar vienas mūsų tikslų tikrai yra tapti pačiu dinamiškiausiu, konkurencingiausiu ir geriausiu pasaulio regionu iki 2010 m.? 2004 m."
70,We heard Mr Schulz say that those of us who objected to the sheer dishonesty of this project were behaving like Nazis back in the 1930s.,"Mes girdėjome Martin Schulz pasakymą, kad tie iš mūsų, kurie laikosi nuomonės, kad šis projektas nesąžiningas, elgiasi kaip naciai žvelgiant atgal į 1930 m."
71,"The voluntary annex, which provided for the collection of microdata and questions on extremely sensitive topics such as sexual behaviour and literacy, has been deleted entirely.","Savanoriškas priedas dėl mikroduomenų rinkimo ir klausimų jautriomis temomis kaip lytinis gyvenimas ir raštingumas, buvo visiškai išbrauktas."
72,"The first question is on the system we are envisaging for command, that is to say for future responsibilities, and here I am thinking, of course, of institutions in Kosovo.","Pirmas klausimas yra apie sistemą, su kuria priverstinai susiduriame, t. y. apie ateities įsipareigojimus ir, aš manau, žinoma, apie Kosovo institucijas."
73,"(RO) Ladies and gentlemen, at present, Europe is dealing with substantial demographic challenges that will have a long-term impact on its future.","(RO) Ponios ir ponai, šiuo metu Europoje sprendžiamos svarbios demografinės problemos, kurios turės ilgalaikės įtakos ateičiai."
74,"I would point out that the European People's Party, along with the UEN and other groups, requested the deletion of paragraph 24.","Norėčiau atkreipti jūsų dėmesį, kad Europos liaudies parija kartu su UEN ir kitomis frakcijomis pareikalavo išbraukti 24 dalį."
75,That 'you' referred not just to an individual but to a policy that his successors had followed and intensified.,"Tas ""jūs"" reiškne vien asmenį, bet ir politiką, kuria vadovavosi ir kurią stiprino jos pasekėjai."
76,"Let me finally say to the Parliament-basher in the back row that I have a half-hour walk every day to and from the hotel here in Strasbourg, and so I have no need of either limousines or trams.","Leiskite galiausiai pasakyti Parlamento išsišokėliui iš paskutinės eilės, kad kasdieną pėsčiomis po pusvalandį einu pėsčiomis iš ir į savo viešbutį Strasbūre, todėl nesinaudoju nei limuzinais, nei tramvajais."
77,"Mr President, second reading in the European Parliament is another step that bring us closer to establishing a European Institute of Innovation and Technology.","Pone Pirmininke, antrasis svarstymas Europos Parlamente yra dar vienas žingsnis link Europos inovacijų ir technologijų instituto įkūrimo."
78,"Milk quotas should be abolished in 2015, so there is cause to increase milk quotas now by at least 2% and cushion the landing in 2009.","2015 m. turi būti panaikintos pieno kvotos, todėl dabar reikia bent 2 % padidinti pieno kvotas ir diegti ""švelnų nusileidimą"" 2009 m."
79,"Alongside the platitudes, some spoke of the problems that lie behind the averages and become visible if one takes a structured approach.","Greta banalybių, kai kurie kalbėjo apie problemas, kurios slypi už vidurkių ir tampa matomos, ėmus taikyti struktūrizuotą metodą."
80,"There must be better stimulation of the internal workforce, and better flexibility and adaptability for all generations to make it easier for them to reconcile their professional and family lives.",Reikėtų labiau stimuliuoti vidaus darbo jėgą ir lanksčiau spręsti visų kartų profesinio ir asmeninio gyvenimo darninimo problemas.
81,Are we going to eartag people like me who live in a rural area and are married to a woman in a rural area?,"Ar ketiname žmones kaip aš, kurie gyvena kaimo vietovėje ir yra susituokę su moterimi kaimo vietovėje, ženklinti ausies įsagu?"
82,"In addition, one of the most significant obstacles to the full harmonisation of the internal market in defence equipment is precisely the large number of export rules in the EU.","Be to, viena iš didžiausių visiško gynybos įrangos vidaus rinkos suderinimo kliūčių būtent ir yra didelis ES eksporto taisyklių skaičius."
83,"Mr President, there is only one way to ensure harmonisation of excise duty rates in Europe: introducing maximum and minimum rates at the same time.","Pone pirmininke, vienintelis būdas užtikrinti akcizo tarifų suderinimą Europoje: maksimalių ir minimalių tarifų įvedimas vienu metu."
84,"For all these reasons, I believe this report is to be welcomed and should receive the support of an absolute majority.","Manau, kad dėl šių priežasčių pranešimas yra sveikintinas ir turėtų sulaukti absoliučios daugumos palaikymo."
85,"Instead of simply congratulating each other and praising yourselves, I would also expect you talk about the shortcomings of your policy, and about your failures.","Užuot tiesiog sveikinus vieną kitą ir gyrus save, taip pat laukčiau, kad pakalbėtumėte apie jūsų politikos trūkumus bei apie jūsų nesėkmes."
