,en,gr
174,"It is to be hoped that Ukraine will not be the next state, after Georgia, upon which Russia will be able to inflict brutal aggression.","Tikėkimės, kad Ukraina nebus kita valstybpo Gruzijos, prieš kurią Rusija galės panaudoti brutalią agresiją."
175,I am happy with the adoption at first reading of the provision of the Directive changing airport capacity from 1 million to 5 million passengers per year.,"Džiaugiuosi, kad per pirmąjį svarstymą buvo priimta nuostata, kuria oro uosto pajėgumas pakeičiamas nuo 1 mln. iki 5 mln. keleivių per metus."
176,"Mr President, let me congratulate Mr Lundgren on his remarks and also challenge Mr Ryan of the UEN Group, who tells us that the stability provided by the euro has been an enormous boon to Ireland.","Gerb. pirmininke, leiskite man pasveikinti N. Lundgreną už jo pastabas ir ryžtą mesti iššūkį E. Ryanui iš UEN frakcijos, mums teigiančios, kad euro suteiktas stabilumas buvo labai naudingas Airijai."
177,"I think this is one of the core issues that holds Europe together, and it is also a question of solidarity.","Manau, kad tai yra vienas iš esminių klausimų, palaikančių Europos vienybę."
178,Let us keep our common agricultural policy with the flexibility that we have included in our different choices within the rural development policy.,"Vykdykime bendrąją žemės ūkio politiką pasitelkdami lankstumo principą, kuris taikomas kaimo plėtros politikoje, kad turėtume įvairių pasirinkimo galimybių."
179,The strategic importance of coal must not prevent us from finding a way to use this precious resource in a manner that does not have an impact on climate.,"Strateginanglies svarba negali sutrukdyti mums rasti būdą, kaip šiuos brangius išteklius panaudoti taip, kad tai neatsilieptų klimatui."
180,Eastern Europe's fragility in the face of the financial crisis is a matter of concern for EU policy-makers.,"Rytų Europos silpnumas, jai susidūrus su finansų krize, -ES politinius sprendimus priimantiems asmenims susirūpinimą keliantis klausimas."
181,"The motor industry is a key industry, if not the key industry, for Europe and it consists of more than the manufacture of cars.","Automobilių sektorius yra vienas svarbiausių, bene pats svarbiausias, Europai. Tai žymiai daugiau nei vien automobilių gamyba."
182,"This directive provides a minimum, general selection of rights to third-country workers in relation to work.",Direktyvoje dėl darbininkų iš trečiųjų šalių darbo pateikiamas bendras minimalių teisių rinkinys.
183,Who is going to make the positive comments and claim the good things for us so that people know the benefits of being in the European Union and the euro?,"Kas kalbės teigiamai ir pabrėš gerus dalykus, kad žmonės žinotų buvimo Europos Sąjungoje ir euro privalumus?"
184,I do think we need to see a greater complementarity of actions already on-going to alleviate that situation.,"A planas, Europos bendroji žemės ūkio politika, Europos bitėms nepadėjo. Manau, kad padėtį gali pagerinti geresnis jau vykdomų veiksmų derinimas."
185,"on behalf of the IND/DEM Group. - (NL) Madam President, in recent years, we in the European Parliament have approved a great deal of environmental legislation.","IND/DEM frakcijos vardu. - (NL) Ponia pirmininke, per pastaruosius kelerius metus Europos Parlamente patvirtinome daugybę teisės aktų aplinkos apsaugos srityje."
186,The next items are the statements by the Council and the Commission on the preparations for the European Council on 11 and 12 December 2008.,Kiti klausimai - Tarybos ir Komisijos pranešimai dėl pasirengimo 2008 m. gruodžio 11-12 d. Europos Vadovų Tarybos susitikimui.
187,"in writing. - (PL) In announcing its crisis action plan, the European Commission responded to the real need for Community action to stabilise and revive the economy.","raštu. - (PL) Paskelbdama krizės veiksmų planą, Europos Komisija reagavo į Bendrijos veiksmų poreikį stabilizuoti ir gaivinti ekonomiką."
188,"This year 100 million people were driven into poverty as a result of the food and fuel crisis, and that number continues to grow.","Šiais metais 100 mln. žmonių patyrskurdą dėl maisto ir kuro krizės, o tas skaičius ir toliau didėja."
189,The problem will not be solved either by imposing restrictions on countries with significant carbon emission levels.,"Taip pat problema nebus išspręsta ir įdiegus apribojimus valstybėms, kuriose anglies išmetimo lygis aukštas."
190,"in writing. - (SV) We have chosen to vote in favour of the report, as it deals with several very important issues relating to the situation of women in the Balkans.","raštu. - (SV) Mes nusprendėme balsuoti už pranešimą, nes jame nagrinėjamos kelios labai svarbios problemos, susijusios su moterų padėtimi Balkanuose."
191,"I would suggest that at the demonstration to be held in front of Parliament on Wednesday, the day we vote, they sit down for a chat with a few workers.","Aš pasiūlyčiau jiems trečiadienį, tądien, kai balsuosime, prieš Parlamento pastatą vyksiančioje demonstracijoje atsisėsti ir pakalbėti su keliais darbuotojais."
192,"The elimination of weaker and poorer undertakings will obviously benefit large corporations, and these are mainly German.","Akivaizdu, kad silpnesnių ir sunkiau besiverčiančių įmonių pašalinimas bus naudingas didelėms korporacijoms, ypač Vokietijoje."
193,"Your Presidency has demonstrated that the project for a European policy, and a political Europe, can exist.","Jūsų pirmininkavimas parodė, kad Europos politikos projektas ir politinEuropa gali gyvuoti."
194,"With the exception of only one country, all countries understood that they could achieve this target, and for this they have two additional instruments.","Išskyrus vieną šalį, visos šalys suprato, kad jos galėtų pasiekti šį tikslą, o tam jos turi dvi papildomas priemones."
195,"The transfer of responsibility following the closure of storage sites has now been set at 20 years, which is also very positive.","Dabar nustatyta, kad atsakomybuž saugyklas perduodama praėjus dvidešimčiai metų nuo jų uždarymo, ir tai taip pat labai teigiamas sprendimas."
196,I would like to conclude by thanking Mrs Kauppi for all her hard work in the European Parliament and I wish her every success in her new venture.,Norėčiau užbaigti padėkodamas P.-N. Kauppi už visą jos sunkų darbą Europos Parlamente ir palinkėti visokeriopos sėkmės naujoje jos veikloje.
197,"For all these reasons, I would like to respect the desire that Hu Jia has expressed on many occasions.","Todėl norėčiau atsižvelgti į troškimą, kurį Hu Jia ne kartą išreiškė."
198,"However, the EU countries are democratic states governed by law and they support the European Convention's declaration on human rights.","Kita vertus, ES šalys yra demokratinės, įstatymo viršenybę pripažįstančios valstybės, remiančios Europos konvencijoje įtvirtintą žmogaus teisių deklaraciją."
199,"Firstly, I should like to pay tribute to what Mrs Roure said in opening our debate, in saying that, indeed, the Charter of Fundamental Rights has been able to unite social rights and civil rights.","Pirma, norėčiau parodyti pagarbą tam, ką pasakM. Roure pradėdama mūsų diskusiją, ir pareikšti, kad iš tikrųjų Pagrindinių teisių chartijai pavyko suvienyti socialines ir pilietines teises."
200,"Parliament is aware of the increasing need for funding and has, for the third year running, petitioned for an increase in the budget for the FRONTEX agency.",Parlamentas žino apie didėjantį finansavimo poreikį ir jau trečius metus ragina padidinti agentūros FRONTEX biudžetą.
201,"The warnings about toys involved mainly the risk of injury to children or the danger of provoking various allergies and health problems, particularly for allergy sufferers.","Įspėjimai dėl žaislų dažniausiai būdavo susiję su grėsme, kad vaikai gali susižeisti, arba įvairių alerginių reakcijų ir sveikatos problemų, su kuriomis pirmiausia gali susidurti kenčiantys nuo alergijos vaikai, pavojumi."
202,"It is not driven by Israeli security needs; in fact, it is a cynical and clinical attack not on Hamas, but on the Palestinian population.","Jo varomoji jėga - ne Izraelio saugumo poreikiai. Iš tiesų tai ciniška ir šaltakraujataka ne organizacijos ""Hamas"", o Palestinos gyventojų atžvilgiu."
203,"You cannot today deny us this action plan and explain to us that you are implementing it on the quiet, without Parliament's deliberations, without Parliament's control, without any visibility.","Šiandien negalite atsisakyti šio veiksmų plano ir aiškinti mums, kad jį įgyvendinate slaptai, be konsultacijų su Parlamentu, be Parlamento kontrolės ir nematomai."
204,"The spread of their public debt securities would be much greater than currently, and their margins for combating the crisis through fiscal stimuli would be narrower.","Jų valstybės skolos vertybinių popierių siūlomos ir prašomos kainos skirtumas būtų gerokai didesnis negu dabar. Pasipriešinimo krizei, taikant finansines skatinimo priemones, galimybės būtų gerokai siauresnės."
205,"Irregularities were confirmed on as many as 43.6% of the websites reviewed, which only confirms the necessity of greater monitoring in relation to the enforcement of existing provisions.","43,6 proc. patikrintų interneto svetainių atveju nustatyta taisyklių pažeidimų; tai tik patvirtina šiuo metu galiojančių teisės aktų vykdymo didesnės stebėsenos būtinumą."
206,"That may also contribute to strengthening research and development, not just within these industries, but also in a section of European industry that feeds off their development.","Tai taip pat galėtų padėti stiprinti mokslinius tyrimus ir plėtrą ne tik gynybos pramonės sektoriuje, bet ir kituose Europos pramonės sektoriuose, kurie prisideda prie gynybos pramonės plėtros."
207,"One of these substances is dichloromethane (DCM), which is generally used for manufacturing pharmaceuticals, solvents and other products.","Viena iš tokių medžiagų yra dichlorometanas, kuris plačiai naudojamas gaminant vaistus, tirpiklius ir kitus produktus."
208,"This report is something else entirely, and does not, in fact, refer to the title and mandate given to it.",Šis pranešimas parengtas visiškai kitu klausimu ir neturi nieko bendro su jam suteiktu pavadinimu ir įgaliojimu.
209,"Yes, Mr Obama is going to talk to Iran and we must talk to everyone, including Hamas, in the Middle East.","B. Obama derėsis su Iranu, ir mes turime vesti derybas su visais Artimuosiuose Rytuose, įskaitant ""Hamas""."
210,"This energy supply crisis, the most serious to date, may be the final wake-up call for Member States, and we must take steps to reduce our energy dependency.","Ši energijos tiekimo krizė, pati rimčiausia iš visų iki šiol įvykusių, gali būti baigiamuoju valstybių narių raginimu, ir privalome imtis veiksmų mūsų energijos priklausomybei mažinti."
211,"It will itself have to meet the conditions and overcome its internal challenges by its own means, but we can help.","Ji pati turės įvykdyti sąlygas ir įveikti vidinius sunkumus savo priemonėmis, tačiau galime jai padėti."
212,"It is the result of Israel's aggressive policy, supported by the USA and the EU, of illegal settlements and its refusal to return to the 1967 borders.",Tai Izraelio agresyvios JAV ir ES remiamos neteisėtų gyvenviečių kūrimo ir atsisakymo grįžti prie 1967 m. sienų politikos rezultatas.
213,"This is happening in the area of services, financial services and the trade in services, in particular.","Protekcionizmas ypač ryškus sprendžiant klausimus, susijusius su paslaugų, finansinių paslaugų ir prekybos paslaugomis sritimis."
214,"If we had not received an emergency transfer of gas from Germany through the Czech Republic to Slovakia, households would also have been at risk.","Jei iš Vokietijos per Čekiją į Slovakiją nebūtume sulaukę blogiausiam atvejui skirto dujų perdavimo, mūsų namų ūkiai taip pat būtų atsidūrę pavojuje."
215,"Furthermore, and especially, we will organise prevention by managing offenders on the basis of an individual diagnosis and a risk assessment for each offender.","Be to, kas ypač svarbu, prevenciją organizuosime ir nusikaltėlius valdysime remdamiesi atskira kiekvieno nusikaltėlio diagnoze ir kiekvieno nusikaltėlio rizikos vertinimu."
216,"Forests currently cover 33% of the land area of the countries of the European Economic Area, corresponding to 185 million hectares.","Šiuo metu miškai sudaro 33 proc. Europos ekonominės erdvės valstybių ploto, o tai sudaro 185 mln. hektarų."
217,"Let us all demonstrate solidarity and act on behalf of European Union citizens who are ill-treated, detained, kidnapped, or held in camps.","Parodykime solidarumą ir veikime Europos Sąjungos piliečių, su kuriais žiauriai elgiamasi, kurie sulaikomi, grobiami ar laikomi stovyklose, labui."
218,"(RO) Minorities of any kind must be supported, not only in terms of preserving a unique identity, their values, traditions and language, but also for developing their culture.","(RO) Bet kokios mažumos turi būti remiamos, ne tik unikalios tapatybės, vertybių, tradicijų ir kalbos išsaugojimo, bet ir kultūros plėtros prasme."
219,"Building on the solid scientific advice at our disposal, and insisting that negotiations must be guided by science, remains vital.","Svarbiausi reikalavimai - rėmimasis patikimais moksliniais patarimais ir reikalavimas, kad derybose būtų vadovaujamasi mokslu."
220,"on behalf of the ALDE Group. - (DA) Madam President, first of all I would like to express my deep satisfaction with this motion for a resolution and to thank Mr Lagendijk for his sterling work.","ALDE frakcijos vardu. - (DA) Gerb pirmininke, pirmiausia norėčiau nuoširdžiai pritarti šiam pasiūlymui dėl rezoliucijos ir padėkoti Joostui Lagendijkui už gerą darbą."
221,"President-in-Office of the Council. - In response to Mr Medina Ortega's question, which relates to the WTO, I think it is an important issue.","einantis Tarybos Pirmininko pareigas. - Atsakydamas į Manuelio Medina Ortega klausimą, susijusį su PPO, manau, kad tai svarbi tema."
222,"As a further recommendation, I would also like to mention that the report was adopted unanimously by the members of the Committee on Agriculture and Rural Development.","Kaip dar vieną rekomendaciją norėčiau paminėti, kad Žemės ūkio ir kaimo plėtros komitete pranešimas buvo patvirtintas vienbalsiai."
223,The terrible events in Gaza should also force us to take a more strategic and long-term look at Gaza.,Siaubingi įvykiai Gazoje turėtų paskatinti imtis strategiškesnių ir ilgalaikių priemonių Gazoje.
224,We must capitalise on the current climate in relations with the US to open up a new chapter in this area to boost our power at a global level.,"Turime pasinaudoti dabartiniu santykių su JAV atšilimu, kad atvertume naują skyrių šioje srityje ir padidintume savo įtaką pasauliniame lygmenyje."
225,"That is why we have been looking for a modest instrument with which the EU can implement policy in developing countries that does not, strictly speaking, fall within the scope of fighting poverty.","Štai kodėl ieškojome paprastos priemonės, dėl kurios ES galėtų įgyvendinti politiką besivystančiose šalyse, kurios, kalbant iš esmės, nepatenka į kovos su skurdu kategoriją."
226,"However, common frameworks should apply, guaranteeing that the law is both transparent and free from ambiguity, and that the market operates cohesively and smoothly.","Tačiau būtina nustatyti bendrą pagrindą, garantuojantį, kad įstatymas būtų skaidrus ir nedviprasmiškas, ir kad rinka galėtų veikti darniai ir sklandžiai."
227,We have long expressed our opposition to the Treaty and do not believe that it would be in the interests of the UK and the EU to have the new foreign policy tools provided for in the Treaty.,"Mes jau seniai reiškiame nepritarimą šiai sutarčiai, ir nemanoma, kad Sutartyje numatyti naujieji užsienio politikos įrankiai atitiktų JK ir ES interesus."
228,"Secondly, these kinds of transfers should, conversely, contribute to protecting the existing rights of shareholders, creditors, and especially the rights of employees.","Antra, apibrėžiant šiuos perkėlimo būdus turi būti be išlygų užtikrinta akcininkų, kreditorių ir ypač darbuotojų galiojančių teisių apsauga."
229,We have been seeing a steep rise in demand caused by economic and population growth and also by the desire for individual mobility.,Mums teko stebėti labai padidėjusią paklausą dėl ekonominio ir gyventojų augimo bei asmenų judumo. Pastaraisiais mėnesiai ir metais tai mus veikįvairiais būdais.
230,"Ladies and gentlemen, Europe, as the ancestral home of culture, cannot continue to do nothing in the face of these problems that make it suffer.","Ponios ir ponai, Europa kaip protėvių kultūros namai, negali toliau nespręsti šių kankinančių ją problemų."
231,"I therefore rejected the first part of the paragraph, and because the plenary voted overall in favour of that paragraph, I voted against this report in the final vote.","Todėl atmečiau pirmąją tos pranešimo dalies dalį ir, kadangi per plenarinį posėdį buvo balsuota už visą pranešimo dalį, per galutinį balsavimą balsavau prieš šį pranešimą."
232,Investments in infrastructure development should be based on the designated environmental protection priorities which take into account the EU climate change targets.,"Investicijos į infrastruktūros plėtojimą turėtų būti grindžiamos tiksliniais prioritetais aplinkos apsaugos srityje, nustatomais atsižvelgiant į ES tikslus dėl klimato kaitos."
233,"For all these years, the Member States in question have allowed their vessels to multiply to scandalous levels, while the European Commission has stood by passively.","Visus šiuo metus minėtos valstybės narės leido savo laivynams didėti iki skandalingo dydžio, o Europos Komisija pasyviai laukė."
234,"Instead, the strategy states that the market needs rules if it is to meet its social and environmental responsibilities.","Priešingai, strategijoje teigiama, kad rinkai reikia nustatyti taisykles, susijusias su jos socialine ir aplinkosaugine atsakomybe."
235,The economic situation has deteriorated so much that it justifies concerted action by the Member States to try to relaunch economic activity.,"Ekonominpadėtis taip pablogėjo, kad ji pateisina bendrus valstybių narių veiksmus bandant atgaivinti ekonominę veiklą."
236,"My country, Romania, was not prepared for accession, and there are still deficiencies in the area of minority rights.",Mano šalis Rumunija nebuvo pasirengusi narystei ir dabar vis dar yra trūkumų mažumų teisių srityje.
237,"From what the Commissioner has said, from all the evidence given by all the NGOs that have got anywhere near there, that seems to be reflective of what is happening.","Atsižvelgiant į tai, ką pasakKomisijos narė, tai matyti iš ten esančių NVO informacijos."
238,Engaging in talks on rights which are in accordance with the principles of the Chinese constitution would not pose any significant risk for China.,"Dalyvavimas derybose dėl teisių, atitinkančių Kinijos konstitucijos principus, nekeltų didelės grėsmės Kinijai."
239,"Ironically enough, the Forum aims to address the problem of the lack of access to water experienced by billions of people throughout the world.","Ironiška, kad Forumo tikslas yra diskutuoti apie negalėjimo gauti vandens problemą, su kuria susiduria milijardai žmonių visame pasaulyje."
240,"Bravo, Dagmar, for your work on the draft of the European Parliament and Council regulation presented to us by the Commission.","Puiku, sveikinu, gerb. Dagmar, už jūsų darbą dėl Europos Parlamento ir Tarybos reglamento projekto, kurį mums pristatKomisija."
241,"However, I am convinced that something could also be done in this respect at national and regional level.","Tačiau esu įsitikinusi, kad šiuo atžvilgiu kai kurių veiksmų galima imtis ir nacionaliniu bei regioniniu lygmenims."
242,This is fundamental and we should therefore be having a debate about that instead of just one passage being devoted to it in a report.,"Tai itin svarbu, todėl šiam klausimui reikėtų skirti atskirą diskusiją, o ne vieną pastraipą pranešime."
243,This report highlights the fact that territorial cohesion will be especially relevant for geographically disadvantaged areas such as mountainous regions and islands.,"Šiame pranešime pabrėžiamas faktas, kad teritorinsanglauda bus ypač svarbi nepalankios geografinės padėties regionams, pvz., kalnų vietovėms arba saloms."
244,"However, even the best possible and most desirable organisation of public transport will never be able to replace the flexibility of individual means of transport.",Tačiau pats geriausias ir labiausiai pageidaujamas viešojo transporto organizavimas niekada nesugebės pakeisti asmeninių transporto priemonių lankstumo.
245,I should like to thank the European Parliament once again for its significant contribution in keeping the environmental objective of the proposal intact and achieving agreement at first reading.,"Norėčiau dar kartą padėkoti Europos Parlamentui už jo didelį indėlį, išlaikant su aplinka susijusį pasiūlymo tikslą, jo nepakeičiant, ir pasiekus susitarimą per pirmąjį svarstymą."
246,I think it is important to believe that it is with ourselves and not with others that we will solve the situation.,"Manau, kad svarbu tikėti, kad problemas išspręsime patys, o ne kitų padedami."
247,"A partnership based on shared values of freedom, human and civil rights and democracy, values which have proved their worth over the past 60 years.","Reikalinga partnerystė, pagrįsta bendromis laisvės, žmogaus teisių ir pilietinių teisių bei demokratijos vertybėmis, kurios įrodsavo vertę per praėjusius 60 metų."
248,"We remember the victims of authoritarian systems, the victims in European countries, in nationalistic and militaristic regimes, in Spain, in Portugal and in Greece.","Atsimename autoritarinių sistemų aukas, aukas Europos šalyse, nacionalistiniuose ir militaristiniuose režimuose, Ispanijoje, Portugalijoje ir Graikijoje."
249,"This approach is in keeping with this Parliament's position on other similar programmes which we were recently discussing in the House, such as the plan to hand out fruit in the schools.","Toks požiūris neprieštarauja šio Parlamento pozicijoms kitų panašių programų, neseniai aptartų Parlamente, atžvilgiu, pvz., planui mokyklose dalyti vaisius."
250,"Madam President, Commissioner, I should like to start by welcoming the initiative on such an interesting issue as the role of culture in the development of the regions of the European Union.","Gerb. pirmininke, gerb. Komisijos nary, norėčiau iš pradžių pasidžiaugti, kad iškeltas toks įdomus klausimas apie kultūros reikšmę Europos Sąjungos regionų vystymuisi."
251,"(FR) Mr President, Commissioner, I would simply like to remind you that it was the polar bears on the ice floes who showed us how much chemical pollution was affecting the whole of the world.","(FR) Pone pirmininke, Komisijos nare, tik norėčiau priminti, kad būtent baltosios meškos ant atskilusių ledo lyčių rodo, kaip smarkiai chemintarša paveikvisą pasaulį."
252,"The European Parliament, through the Committee on Regional Development, is constantly calling for greater simplification of administrative rules.",Europos Parlamentas Regioninės plėtros komiteto atstovų lūpomis nuolat ragina supaprastinti administracines taisykles.
253,Our review of this regulation is part of a broader European action plan for sustainable production and consumption and it is closely linked to the review of EMAS and the Ecodesign directive.,"Mūsų parengta šio reglamentavimo apžvalga yra platesnio Europos veiksmų plano dėl atsinaujinančios gamybos ir vartojimo dalis, ir ji glaudžiai susijusi su AVAS ir Ekologinio dizaino direktyvos apžvalga."
254,"For all these reasons, which led me to vote against that report, I cannot fully support this report, which is why I have abstained.","Dėl visų šių priežasčių, kurios privertmane balsuoti prieš šį pranešimą, aš negaliu besąlygiškai palaikyti šį pranešimą - kaip tik dėl to aš susilaikiau."
255,"I would like to stress that the third package is a major political event, not only a technical and economic one, and we really should recognise it as a great success of the European Union.","Norėčiau pabrėžti, kad trečiasis paketas - svarbus laimėjimas ne tik techniniu ir ekonominiu, bet ir politiniu požiūriu. Ir tai tikrai labai didelEuropos Sąjungos sėkmė."
256,This is a bad start to an attempt to establish the culture of compliance to which the Commission so often refers.,"Bloga pradžia pastangoms nustatyti paklusnumo kultūrą, apie kurią taip dažnai kalba Komisija."
257,We support this amendment to the regulation and we hope that this Parliament will give its full support to this worthwhile proposal.,"Pritariame šiam reglamento pataisymui ir tikimės, kad Parlamentas visiškai parems šį vertingą pasiūlymą."
258,"Concerning safe building standards, these standards exist but the question is how closely these standards are followed in Member States.","Kalbėdamas apie saugios statybos standartus turiu pasakyti, kad tokie standartai egzistuoja, tačiau kyla klausimas, kiek jų laikomasi valstybėse narėse."
